chapter,verse,verse_id,sanskrit,transliteration,translation
4,28,4.28,"द्रव्ययज्ञास्तपोयज्ञा योगयज्ञास्तथापरे |
स्वाध्यायज्ञानयज्ञाश्च यतयः संशितव्रताः ||४-२८||","dravyayajñāstapoyajñā yogayajñāstathāpare .
svādhyāyajñānayajñāśca yatayaḥ saṃśitavratāḥ ||4-28||","4.28 Others again offer wealth, austerity and Yoga as sacrifice, while the ascetics of self-restraint and rigid vows offer study of scriptures and knowledge as sacrifice."
4,29,4.29,"अपाने जुह्वति प्राणं प्राणेऽपानं तथापरे |
प्राणापानगती रुद्ध्वा प्राणायामपरायणाः ||४-२९||","apāne juhvati prāṇaṃ prāṇe.apānaṃ tathāpare .
prāṇāpānagatī ruddhvā prāṇāyāmaparāyaṇāḥ ||4-29||","4.29 Others offer as sacrifice the outgoing breath in the incoming, and the incoming in the outgoing, restraining the course of the outgoing and the incoming breaths, solely absorbed in the restraint of the breath."
4,30,4.30,"अपरे नियताहाराः प्राणान्प्राणेषु जुह्वति |
सर्वेऽप्येते यज्ञविदो यज्ञक्षपितकल्मषाः ||४-३०||","apare niyatāhārāḥ prāṇānprāṇeṣu juhvati .
sarve.apyete yajñavido yajñakṣapitakalmaṣāḥ ||4-30||","4.30 Others who regulate their diet offer life-breaths in life-breaths. All these are knowers of sacrifice, whose sins are destroyed by sacrifice."
4,31,4.31,"यज्ञशिष्टामृतभुजो यान्ति ब्रह्म सनातनम् |
नायं लोकोऽस्त्ययज्ञस्य कुतोऽन्यः कुरुसत्तम ||४-३१||","yajñaśiṣṭāmṛtabhujo yānti brahma sanātanam .
nāyaṃ loko.astyayajñasya kuto.anyaḥ kurusattama ||4-31||","4.31 Those who eat the remnants of the sacrifice, which are like nectar, go to the eternal Brahman. This world is not for the man who does not perform sacrifice; how then can he have the other, O Arjuna?"
4,32,4.32,"एवं बहुविधा यज्ञा वितता ब्रह्मणो मुखे |
कर्मजान्विद्धि तान्सर्वानेवं ज्ञात्वा विमोक्ष्यसे ||४-३२||","evaṃ bahuvidhā yajñā vitatā brahmaṇo mukhe .
karmajānviddhi tānsarvānevaṃ jñātvā vimokṣyase ||4-32||","4.32 Thus, manifold sacrifices are spread out before Brahman (literally) at the mouth or face of Brahman). Know them all as born of action and thus knowing, thou shalt be liberated."
4,33,4.33,"श्रेयान्द्रव्यमयाद्यज्ञाज्ज्ञानयज्ञः परन्तप |
सर्वं कर्माखिलं पार्थ ज्ञाने परिसमाप्यते ||४-३३||","śreyāndravyamayādyajñājjñānayajñaḥ parantapa .
sarvaṃ karmākhilaṃ pārtha jñāne parisamāpyate ||4-33||",Swami Sivananda did not comment on this sloka
4,34,4.34,"तद्विद्धि प्रणिपातेन परिप्रश्नेन सेवया |
उपदेक्ष्यन्ति ते ज्ञानं ज्ञानिनस्तत्त्वदर्शिनः ||४-३४||","tadviddhi praṇipātena paripraśnena sevayā .
upadekṣyanti te jñānaṃ jñāninastattvadarśinaḥ ||4-34||","4.34 Know That by long prostration, by estion and by service; the wise who have realised the Truth will instruct thee in (that) knowledge."
4,35,4.35,"यज्ज्ञात्वा न पुनर्मोहमेवं यास्यसि पाण्डव |
येन भूतान्यशेषेण द्रक्ष्यस्यात्मन्यथो मयि (var अशेषाणि) ||४-३५||","yajjñātvā na punarmohamevaṃ yāsyasi pāṇḍava .
yena bhūtānyaśeṣāṇi drakṣyasyātmanyatho mayi ||4-35||","4.35 Knowing ï1thatï1 thou shalt not, O Arjuna, again get deluded like this; and by that thou shalt see all beings in thy Self and also in Me."
4,36,4.36,"अपि चेदसि पापेभ्यः सर्वेभ्यः पापकृत्तमः |
सर्वं ज्ञानप्लवेनैव वृजिनं सन्तरिष्यसि ||४-३६||","api cedasi pāpebhyaḥ sarvebhyaḥ pāpakṛttamaḥ .
sarvaṃ jñānaplavenaiva vṛjinaṃ santariṣyasi ||4-36||","4.36 Even if thou art the most sinful of all sinners, yet thou shalt verily cross all sins by the raft of knowledge."
4,37,4.37,"यथैधांसि समिद्धोऽग्निर्भस्मसात्कुरुतेऽर्जुन |
ज्ञानाग्निः सर्वकर्माणि भस्मसात्कुरुते तथा ||४-३७||","yathaidhāṃsi samiddho.agnirbhasmasātkurute.arjuna .
jñānāgniḥ sarvakarmāṇi bhasmasātkurute tathā ||4-37||","4.37 As the blazing fire reduces fuel to ashes, O Arjuna, so does the fire of knowledge reduce all actions to ashes."
4,38,4.38,"न हि ज्ञानेन सदृशं पवित्रमिह विद्यते |
तत्स्वयं योगसंसिद्धः कालेनात्मनि विन्दति ||४-३८||","na hi jñānena sadṛśaṃ pavitramiha vidyate .
tatsvayaṃ yogasaṃsiddhaḥ kālenātmani vindati ||4-38||","4.38 Verily, there is no purifier in this world like knowledge. He who is perfected in Yoga finds it in the Self in time."
4,39,4.39,"श्रद्धावाँल्लभते ज्ञानं तत्परः संयतेन्द्रियः |
ज्ञानं लब्ध्वा परां शान्तिमचिरेणाधिगच्छति ||४-३९||","śraddhāvā.Nllabhate jñānaṃ tatparaḥ saṃyatendriyaḥ .
jñānaṃ labdhvā parāṃ śāntimacireṇādhigacchati ||4-39||","4.39 The man who is full of faith, who is devoted to it, and who has subdued the senses obtains (this) knowledge; and having obtained the knowledge he attains at once to the supreme peace."
4,40,4.40,"अज्ञश्चाश्रद्दधानश्च संशयात्मा विनश्यति |
नायं लोकोऽस्ति न परो न सुखं संशयात्मनः ||४-४०||","ajñaścāśraddadhānaśca saṃśayātmā vinaśyati .
nāyaṃ loko.asti na paro na sukhaṃ saṃśayātmanaḥ ||4-40||","4.40 The ignorant the faithless, the doubting self goes to destruction; there is neither this world nor the other, nor happiness for the doubting."
4,41,4.41,"योगसंन्यस्तकर्माणं ज्ञानसञ्छिन्नसंशयम् |
आत्मवन्तं न कर्माणि निबध्नन्ति धनञ्जय ||४-४१||","yogasaṃnyastakarmāṇaṃ jñānasañchinnasaṃśayam .
ātmavantaṃ na karmāṇi nibadhnanti dhanañjaya ||4-41||","4.41 He who has renounced actions by Yoga, whose doubts are rent asunder by knowledge, and who is self-possessed  actions do not bind him, O Arjuna."
4,42,4.42,"तस्मादज्ञानसम्भूतं हृत्स्थं ज्ञानासिनात्मनः |
छित्त्वैनं संशयं योगमातिष्ठोत्तिष्ठ भारत ||४-४२||","tasmādajñānasambhūtaṃ hṛtsthaṃ jñānāsinātmanaḥ .
chittvainaṃ saṃśayaṃ yogamātiṣṭhottiṣṭha bhārata ||4-42||","4.42 Therefore with the sword of the knowledge (of the Self) cut asunder the doubt of the self born of ignorance, residing in thy heart, and take refuge in Yoga. Arise, O Arjuna."
5,1,5.1,"अर्जुन उवाच |
संन्यासं कर्मणां कृष्ण पुनर्योगं च शंससि |
यच्छ्रेय एतयोरेकं तन्मे ब्रूहि सुनिश्चितम् ||५-१||","arjuna uvāca .
saṃnyāsaṃ karmaṇāṃ kṛṣṇa punaryogaṃ ca śaṃsasi .
yacchreya etayorekaṃ tanme brūhi suniścitam ||5-1||","5.1 Arjuna said  Renunciation of actions, O Krishna, Thou praisest, and again Yoga. Tell me conclusively that which is the better of the two."
5,2,5.2,"श्रीभगवानुवाच |
संन्यासः कर्मयोगश्च निःश्रेयसकरावुभौ |
तयोस्तु कर्मसंन्यासात्कर्मयोगो विशिष्यते ||५-२||","śrībhagavānuvāca .
saṃnyāsaḥ karmayogaśca niḥśreyasakarāvubhau .
tayostu karmasaṃnyāsātkarmayogo viśiṣyate ||5-2||","5.2 The Blessed Lord said  Renunciation and the Yoga of action both lead to the highest bliss; but of the two, the Yoga of action is superior to the renunciation of action."
5,3,5.3,"ज्ञेयः स नित्यसंन्यासी यो न द्वेष्टि न काङ्क्षति |
निर्द्वन्द्वो हि महाबाहो सुखं बन्धात्प्रमुच्यते ||५-३||","jñeyaḥ sa nityasaṃnyāsī yo na dveṣṭi na kāṅkṣati .
nirdvandvo hi mahābāho sukhaṃ bandhātpramucyate ||5-3||","5.3 He should be known as a perpertual Sannyasi who neither hates nor desires; for, free from the pairs of opposites, O mighty-armed Arjuna, he is easily set free from bondage."
5,4,5.4,"साङ्ख्ययोगौ पृथग्बालाः प्रवदन्ति न पण्डिताः |
एकमप्यास्थितः सम्यगुभयोर्विन्दते फलम् ||५-४||","sāṅkhyayogau pṛthagbālāḥ pravadanti na paṇḍitāḥ .
ekamapyāsthitaḥ samyagubhayorvindate phalam ||5-4||","5.4 Children, not the wise, speak of knowledge and the Yoga of action or the performance of action as though they are distinct and different; he who is truly established in one obtains the fruits of both."
5,5,5.5,"यत्साङ्ख्यैः प्राप्यते स्थानं तद्योगैरपि गम्यते |
एकं साङ्ख्यं च योगं च यः पश्यति स पश्यति ||५-५||","yatsāṅkhyaiḥ prāpyate sthānaṃ tadyogairapi gamyate .
ekaṃ sāṅkhyaṃ ca yogaṃ ca yaḥ paśyati sa paśyati ||5-5||","5.5 That place which is reached by the Sankhyas or the Jnanis is reached by the Yogis (Karma Yogis). He sees, who sees knowledge and the performance of action (Karma Yoga) as one."
5,6,5.6,"संन्यासस्तु महाबाहो दुःखमाप्तुमयोगतः |
योगयुक्तो मुनिर्ब्रह्म नचिरेणाधिगच्छति ||५-६||","saṃnyāsastu mahābāho duḥkhamāptumayogataḥ .
yogayukto munirbrahma nacireṇādhigacchati ||5-6||","5.6 But renunciation, O mighty-armed Arjuna, is hard to attain without Yoga; the Yoga-harmonised sage ickly goes to Brahman."
5,7,5.7,"योगयुक्तो विशुद्धात्मा विजितात्मा जितेन्द्रियः |
सर्वभूतात्मभूतात्मा कुर्वन्नपि न लिप्यते ||५-७||","yogayukto viśuddhātmā vijitātmā jitendriyaḥ .
sarvabhūtātmabhūtātmā kurvannapi na lipyate ||5-7||","5.7 He who is devoted to the path of action, whose mind is ite pure, who has conered the self, who has subdued his senses and who realises his Self as the Self in all beings, though acting, is not tainted."
5,8,5.8,"नैव किञ्चित्करोमीति युक्तो मन्येत तत्त्ववित् |
पश्यञ्शृण्वन्स्पृशञ्जिघ्रन्नश्नन्गच्छन्स्वपञ्श्वसन् ||५-८||","naiva kiñcitkaromīti yukto manyeta tattvavit .
paśyañśruṇvanspṛśañjighrannaśnangacchansvapañśvasan ||5-8||","5.8 ""I do nothing at all,"" thus would the harmonised knower of Truth think  seeing, hearing, touching, smelling, eating, going, sleeping, breathing."
5,9,5.9,"प्रलपन्विसृजन्गृह्णन्नुन्मिषन्निमिषन्नपि |
इन्द्रियाणीन्द्रियार्थेषु वर्तन्त इति धारयन् ||५-९||","pralapanvisṛjangṛhṇannunmiṣannimiṣannapi .
indriyāṇīndriyārtheṣu vartanta iti dhārayan ||5-9||","5.9 Speaking, letting go, seizing, opening and closing the eyes  convinced that the senses move among the sense-objects."
5,10,5.10,"ब्रह्मण्याधाय कर्माणि सङ्गं त्यक्त्वा करोति यः |
लिप्यते न स पापेन पद्मपत्रमिवाम्भसा ||५-१०||","brahmaṇyādhāya karmāṇi saṅgaṃ tyaktvā karoti yaḥ .
lipyate na sa pāpena padmapatramivāmbhasā ||5-10||","5.10 He who does actions, offering them to Brahman, and abandoning attachment, is not tainted by sin, just as a lotus-leaf is not tainted by water."
5,11,5.11,"कायेन मनसा बुद्ध्या केवलैरिन्द्रियैरपि |
योगिनः कर्म कुर्वन्ति सङ्गं त्यक्त्वात्मशुद्धये ||५-११||","kāyena manasā buddhyā kevalairindriyairapi .
yoginaḥ karma kurvanti saṅgaṃ tyaktvātmaśuddhaye ||5-11||","5.11 Yogis, having abandoned attachment, perform actions only by the body, mind, intellect, and even by the senses, for the purification of the self."
5,12,5.12,"युक्तः कर्मफलं त्यक्त्वा शान्तिमाप्नोति नैष्ठिकीम् |
अयुक्तः कामकारेण फले सक्तो निबध्यते ||५-१२||","yuktaḥ karmaphalaṃ tyaktvā śāntimāpnoti naiṣṭhikīm .
ayuktaḥ kāmakāreṇa phale sakto nibadhyate ||5-12||","5.12 The united one (the well poised or the harmonised) having abandoned the fruit of action attains to the eternal peace: the non-united only (the unsteady or the unbalanced) impelled by desire, attached to the fruit, is bound."
5,13,5.13,"सर्वकर्माणि मनसा संन्यस्यास्ते सुखं वशी |
नवद्वारे पुरे देही नैव कुर्वन्न कारयन् ||५-१३||","sarvakarmāṇi manasā saṃnyasyāste sukhaṃ vaśī .
navadvāre pure dehī naiva kurvanna kārayan ||5-13||","5.13 Mentally renouncing all actions and self-controlled, the embodied one rests happily in the nine-gated city, neither acting nor causing others (body and senses) to act."
5,14,5.14,"न कर्तृत्वं न कर्माणि लोकस्य सृजति प्रभुः |
न कर्मफलसंयोगं स्वभावस्तु प्रवर्तते ||५-१४||","na kartṛtvaṃ na karmāṇi lokasya sṛjati prabhuḥ .
na karmaphalasaṃyogaṃ svabhāvastu pravartate ||5-14||","5.14 Neither agency nor actions does the Lord create for the world, nor union with the fruits of actions. But it is Nature that acts."
5,15,5.15,"नादत्ते कस्यचित्पापं न चैव सुकृतं विभुः |
अज्ञानेनावृतं ज्ञानं तेन मुह्यन्ति जन्तवः ||५-१५||","nādatte kasyacitpāpaṃ na caiva sukṛtaṃ vibhuḥ .
ajñānenāvṛtaṃ jñānaṃ tena muhyanti jantavaḥ ||5-15||","5.15 The Lord takes neither the demerit nor even the merit of any; knowledge is enveloped by ignorance, thery beings are deluded."
5,16,5.16,"ज्ञानेन तु तदज्ञानं येषां नाशितमात्मनः |
तेषामादित्यवज्ज्ञानं प्रकाशयति तत्परम् ||५-१६||","jñānena tu tadajñānaṃ yeṣāṃ nāśitamātmanaḥ .
teṣāmādityavajjñānaṃ prakāśayati tatparam ||5-16||","5.16 But to those whose ignorance is destroyed by the knowledge of the Self, like the sun, knowledge reveals the Supreme (Brahman)."
5,17,5.17,"तद्बुद्धयस्तदात्मानस्तन्निष्ठास्तत्परायणाः |
गच्छन्त्यपुनरावृत्तिं ज्ञाननिर्धूतकल्मषाः ||५-१७||","tadbuddhayastadātmānastanniṣṭhāstatparāyaṇāḥ .
gacchantyapunarāvṛttiṃ jñānanirdhūtakalmaṣāḥ ||5-17||","5.17 Their intellect absorbed in That, their self being That, established in That, with That for their supreme goal, they go whence there is no return, their sins dispelled by knowledge."
5,18,5.18,"विद्याविनयसम्पन्ने ब्राह्मणे गवि हस्तिनि |
शुनि चैव श्वपाके च पण्डिताः समदर्शिनः ||५-१८||","vidyāvinayasampanne brāhmaṇe gavi hastini .
śuni caiva śvapāke ca paṇḍitāḥ samadarśinaḥ ||5-18||","5.18 Sages look with an eal eye on a Brahmana endowed with learning and humility, on a cow, on an elephant, and even on a dog and an outcaste."
5,19,5.19,"इहैव तैर्जितः सर्गो येषां साम्ये स्थितं मनः |
निर्दोषं हि समं ब्रह्म तस्माद् ब्रह्मणि ते स्थिताः ||५-१९||","ihaiva tairjitaḥ sargo yeṣāṃ sāmye sthitaṃ manaḥ .
nirdoṣaṃ hi samaṃ brahma tasmād brahmaṇi te sthitāḥ ||5-19||",5.19 Even here (in this world) birth (everything) is overcome by those whose minds rest in eality; Brahman is spotless indeed and eal; therefore they are established in Brahman.
5,20,5.20,"न प्रहृष्येत्प्रियं प्राप्य नोद्विजेत्प्राप्य चाप्रियम् |
स्थिरबुद्धिरसम्मूढो ब्रह्मविद् ब्रह्मणि स्थितः ||५-२०||","na prahṛṣyetpriyaṃ prāpya nodvijetprāpya cāpriyam .
sthirabuddhirasammūḍho brahmavid brahmaṇi sthitaḥ ||5-20||","5.20 Resting in Brahman, with steady intellect and undeluded, the knower of Brahman neither rejoiceth on obtaining what is pleasant nor grieveth on obtaining what is unpleasant."
5,21,5.21,"बाह्यस्पर्शेष्वसक्तात्मा विन्दत्यात्मनि यत्सुखम् |
स ब्रह्मयोगयुक्तात्मा सुखमक्षयमश्नुते ||५-२१||","bāhyasparśeṣvasaktātmā vindatyātmani yatsukham .
sa brahmayogayuktātmā sukhamakṣayamaśnute ||5-21||",5.21 With the self unattached to external contacts he finds happiness in the Self; with the self engaged in    the meditation of Brahman he attains to the endless happiness.
5,22,5.22,"ये हि संस्पर्शजा भोगा दुःखयोनय एव ते |
आद्यन्तवन्तः कौन्तेय न तेषु रमते बुधः ||५-२२||","ye hi saṃsparśajā bhogā duḥkhayonaya eva te .
ādyantavantaḥ kaunteya na teṣu ramate budhaḥ ||5-22||","5.22 The enjoyments that are born of contacts are only generators of pain, for they have a beginning and an end, O Arjuna; the wise man does not rejoice in them."
5,23,5.23,"शक्नोतीहैव यः सोढुं प्राक्शरीरविमोक्षणात् |
कामक्रोधोद्भवं वेगं स युक्तः स सुखी नरः ||५-२३||","śaknotīhaiva yaḥ soḍhuṃ prākśarīravimokṣaṇāt .
kāmakrodhodbhavaṃ vegaṃ sa yuktaḥ sa sukhī naraḥ ||5-23||","5.23 He who is able, while still here (in this world) to withstand, before the liberation from the body, the impulse born out of desire and anger  he is a Yogi, he is a happy man."
5,24,5.24,"योऽन्तःसुखोऽन्तरारामस्तथान्तर्ज्योतिरेव यः |
स योगी ब्रह्मनिर्वाणं ब्रह्मभूतोऽधिगच्छति ||५-२४||","yo.antaḥsukho.antarārāmastathāntarjyotireva yaḥ .
sa yogī brahmanirvāṇaṃ brahmabhūto.adhigacchati ||5-24||","5.24 He who is happy within, who rejoices within, and who is illuminated within, that Yogi attains absolute freedom or Moksha, himself becoming Brahman."
5,25,5.25,"लभन्ते ब्रह्मनिर्वाणमृषयः क्षीणकल्मषाः |
छिन्नद्वैधा यतात्मानः सर्वभूतहिते रताः ||५-२५||","labhante brahmanirvāṇamṛṣayaḥ kṣīṇakalmaṣāḥ .
chinnadvaidhā yatātmānaḥ sarvabhūtahite ratāḥ ||5-25||","5.25 The sages (Rishis) obtain absolute freedom or Moksha  they whose sins have been destroyed, whose dualities (perception of dualities or experience of the pairs of opposites) are torn asunder, who are self-controlled, and intent on the welfare of all beings."
5,26,5.26,"कामक्रोधवियुक्तानां यतीनां यतचेतसाम् |
अभितो ब्रह्मनिर्वाणं वर्तते विदितात्मनाम् ||५-२६||","kāmakrodhaviyuktānāṃ yatīnāṃ yatacetasām .
abhito brahmanirvāṇaṃ vartate viditātmanām ||5-26||","5.26 Absolute freedom (or Brahmic bliss) exists on all sides for those self-controlled ascetics who are free from desire and anger, who have controlled their thoughts and who have realised the Self."
5,27,5.27,"स्पर्शान्कृत्वा बहिर्बाह्यांश्चक्षुश्चैवान्तरे भ्रुवोः |
प्राणापानौ समौ कृत्वा नासाभ्यन्तरचारिणौ ||५-२७||","sparśānkṛtvā bahirbāhyāṃścakṣuścaivāntare bhruvoḥ .
prāṇāpānau samau kṛtvā nāsābhyantaracāriṇau ||5-27||","5.27 Shutting out (all) external contacts and fixing the gaze between the eyrow, ealising the outgoing and incoming breaths moving within the nostrils."
5,28,5.28,"यतेन्द्रियमनोबुद्धिर्मुनिर्मोक्षपरायणः |
विगतेच्छाभयक्रोधो यः सदा मुक्त एव सः ||५-२८||","yatendriyamanobuddhirmunirmokṣaparāyaṇaḥ .
vigatecchābhayakrodho yaḥ sadā mukta eva saḥ ||5-28||","5.28 With the senses, the mind and the intellect (ever) controlled, having liberation as his supreme goal, free from desire, fear and anger  the sage is verily liberated for ever."
5,29,5.29,"भोक्तारं यज्ञतपसां सर्वलोकमहेश्वरम् |
सुहृदं सर्वभूतानां ज्ञात्वा मां शान्तिमृच्छति ||५-२९||","bhoktāraṃ yajñatapasāṃ sarvalokamaheśvaram .
suhṛdaṃ sarvabhūtānāṃ jñātvā māṃ śāntimṛcchati ||5-29||","5.29 He who knows Me as the enjoyer of sacrifices and austerities, the great Lord of all the worlds and the friend of all beings, attains to peace."
6,1,6.1,"श्रीभगवानुवाच |
अनाश्रितः कर्मफलं कार्यं कर्म करोति यः |
स संन्यासी च योगी च न निरग्निर्न चाक्रियः ||६-१||","śrībhagavānuvāca .
anāśritaḥ karmaphalaṃ kāryaṃ karma karoti yaḥ .
sa saṃnyāsī ca yogī ca na niragnirna cākriyaḥ ||6-1||",6.1 The Blessed Lord said  He who performs his bounden duty without depending on the fruits of his actions  he is a Sannyasi and a Yogi; not he who is without fire and without action.
6,2,6.2,"यं संन्यासमिति प्राहुर्योगं तं विद्धि पाण्डव |
न ह्यसंन्यस्तसङ्कल्पो योगी भवति कश्चन ||६-२||","yaṃ saṃnyāsamiti prāhuryogaṃ taṃ viddhi pāṇḍava .
na hyasaṃnyastasaṅkalpo yogī bhavati kaścana ||6-2||","6.2 Do thou, O Arjuna, know Yoga to be that which they call renunciation; no one verily becomes a Yogi who has not renounced thoughts."
