chapter,verse,verse_id,sanskrit,transliteration,translation
1,1,1.1,"धृतराष्ट्र उवाच |
धर्मक्षेत्रे कुरुक्षेत्रे समवेता युयुत्सवः |
मामकाः पाण्डवाश्चैव किमकुर्वत सञ्जय ||१-१||","dhṛtarāṣṭra uvāca .
dharmakṣetre kurukṣetre samavetā yuyutsavaḥ .
māmakāḥ pāṇḍavāścaiva kimakurvata sañjaya ||1-1||","1.1 Dhritarashtra said  What did my people and the sons of Pandu do when they had assembled
together eager for battle on the holy plain of Kurukshetra, O Sanjaya."
1,2,1.2,"सञ्जय उवाच |
दृष्ट्वा तु पाण्डवानीकं व्यूढं दुर्योधनस्तदा |
आचार्यमुपसंगम्य राजा वचनमब्रवीत् ||१-२||","sañjaya uvāca .
dṛṣṭvā tu pāṇḍavānīkaṃ vyūḍhaṃ duryodhanastadā .
ācāryamupasaṃgamya rājā vacanamabravīt ||1-2||","1.2. Sanjaya said  Having seen the army of the Pandavas drawn up in battle-array,
King Duryodhana then approached his teacher (Drona) and spoke these words."
1,3,1.3,"पश्यैतां पाण्डुपुत्राणामाचार्य महतीं चमूम् |
व्यूढां द्रुपदपुत्रेण तव शिष्येण धीमता ||१-३||","paśyaitāṃ pāṇḍuputrāṇāmācārya mahatīṃ camūm .
vyūḍhāṃ drupadaputreṇa tava śiṣyeṇa dhīmatā ||1-3||","1.3. ""Behold, O Teacher! this mighty army of the sons of Pandu,
arrayed by the son of Drupada, thy wise disciple."
1,4,1.4,"अत्र शूरा महेष्वासा भीमार्जुनसमा युधि |
युयुधानो विराटश्च द्रुपदश्च महारथः ||१-४||","atra śūrā maheṣvāsā bhīmārjunasamā yudhi .
yuyudhāno virāṭaśca drupadaśca mahārathaḥ ||1-4||","1.4. Here are heroes, mighty archers, eal in battle to Bhima
and Arjuna, Yoyudhana (Satyaki), Virata and Drupada, of the great car (mighty
warriors)."
1,5,1.5,"धृष्टकेतुश्चेकितानः काशिराजश्च वीर्यवान् |
पुरुजित्कुन्तिभोजश्च शैब्यश्च नरपुंगवः ||१-५||","dhṛṣṭaketuścekitānaḥ kāśirājaśca vīryavān .
purujitkuntibhojaśca śaibyaśca narapuṃgavaḥ ||1-5||","1.5. ""Dhrishtaketu, chekitana and the valiant king of Kasi, Purujit
and Kuntibhoja and Saibya, the best men."
1,6,1.6,"युधामन्युश्च विक्रान्त उत्तमौजाश्च वीर्यवान् |
सौभद्रो द्रौपदेयाश्च सर्व एव महारथाः ||१-६||","yudhāmanyuśca vikrānta uttamaujāśca vīryavān .
saubhadro draupadeyāśca sarva eva mahārathāḥ ||1-6||","1.6. ""The strong Yodhamanyu and the brave Uttamaujas, the son
of Subhadra (Abhimanyu, the son of Subhadra and Arjuna), and the sons of
Draupadi, all of great chariots (great heroes)."
1,7,1.7,"अस्माकं तु विशिष्टा ये तान्निबोध द्विजोत्तम |
नायका मम सैन्यस्य संज्ञार्थं तान्ब्रवीमि ते ||१-७||","asmākaṃ tu viśiṣṭā ye tānnibodha dvijottama .
nāyakā mama sainyasya saṃjñārthaṃ tānbravīmi te ||1-7||","1.7. ""Know also, O best among the twice-born! the names of those
who are the most distinguished amongst ourselves, the leaders of my army;
these I name to thee for thy information."
1,8,1.8,"भवान्भीष्मश्च कर्णश्च कृपश्च समितिञ्जयः |
अश्वत्थामा विकर्णश्च सौमदत्तिस्तथैव च ||१-८||","bhavānbhīṣmaśca karṇaśca kṛpaśca samitiñjayaḥ .
aśvatthāmā vikarṇaśca saumadattistathaiva ca ||1-8||","1.8. ""Thyself and Bhishma, and Karna and also Kripa, the victorious
in war, Asvatthama, Vikarna, and also Bhurisrava, the son of Somadatta."
1,9,1.9,"अन्ये च बहवः शूरा मदर्थे त्यक्तजीविताः |
नानाशस्त्रप्रहरणाः सर्वे युद्धविशारदाः ||१-९||","anye ca bahavaḥ śūrā madarthe tyaktajīvitāḥ .
nānāśastrapraharaṇāḥ sarve yuddhaviśāradāḥ ||1-9||","1.9. ""And also many other heroes who are ready to give up their
lives for my sake, armed with various weapons and missiles, all well-skilled
in battle."
1,10,1.10,"अपर्याप्तं तदस्माकं बलं भीष्माभिरक्षितम् |
पर्याप्तं त्विदमेतेषां बलं भीमाभिरक्षितम् ||१-१०||","aparyāptaṃ tadasmākaṃ balaṃ bhīṣmābhirakṣitam .
paryāptaṃ tvidameteṣāṃ balaṃ bhīmābhirakṣitam ||1-10||","1.10. ""This army of ours marshalled by Bhishma is insufficient,
whereas that army of theirs marshelled by Bhima is sufficient."
1,11,1.11,"अयनेषु च सर्वेषु यथाभागमवस्थिताः |
भीष्ममेवाभिरक्षन्तु भवन्तः सर्व एव हि ||१-११||","ayaneṣu ca sarveṣu yathābhāgamavasthitāḥ .
bhīṣmamevābhirakṣantu bhavantaḥ sarva eva hi ||1-11||","1.11. ""Therefore do ye all, stationed in your respective positions,
in the several divisions of the army, protect Bhishma alone."""
1,12,1.12,"तस्य सञ्जनयन्हर्षं कुरुवृद्धः पितामहः |
सिंहनादं विनद्योच्चैः शङ्खं दध्मौ प्रतापवान् ||१-१२||","tasya sañjanayanharṣaṃ kuruvṛddhaḥ pitāmahaḥ .
siṃhanādaṃ vinadyoccaiḥ śaṅkhaṃ dadhmau pratāpavān ||1-12||","1.12. His glorious grandsire (Bhishma), the oldest of the Kauravas,
in order to cheer Duryodhana, now roared like a lion, and blew his conch."
1,13,1.13,"ततः शङ्खाश्च भेर्यश्च पणवानकगोमुखाः |
सहसैवाभ्यहन्यन्त स शब्दस्तुमुलोऽभवत् ||१-१३||","tataḥ śaṅkhāśca bheryaśca paṇavānakagomukhāḥ .
sahasaivābhyahanyanta sa śabdastumulo.abhavat ||1-13||","1.13. Then (following Bhishma), conches and kettledrums, tabors,
drums and cow horns blared forth ite suddenly (from the Kaurava side)
and the sound was tremendous."
1,14,1.14,"ततः श्वेतैर्हयैर्युक्ते महति स्यन्दने स्थितौ |
माधवः पाण्डवश्चैव दिव्यौ शङ्खौ प्रदध्मतुः ||१-१४||","tataḥ śvetairhayairyukte mahati syandane sthitau .
mādhavaḥ pāṇḍavaścaiva divyau śaṅkhau pradadhmatuḥ ||1-14||","1.14. Then, also, Madhava (Krishna) and the son of Pandu (Arjuna),
seated in the magnificent chariot, yoked with white horses, blew divine
conches."
1,15,1.15,"पाञ्चजन्यं हृषीकेशो देवदत्तं धनञ्जयः |
पौण्ड्रं दध्मौ महाशङ्खं भीमकर्मा वृकोदरः ||१-१५||","pāñcajanyaṃ hṛṣīkeśo devadattaṃ dhanañjayaḥ .
pauṇḍraṃ dadhmau mahāśaṅkhaṃ bhīmakarmā vṛkodaraḥ ||1-15||","1.15. Hrishikesha blew the Panchajanya and Arjuna blew the Devadatta
and Bhima (the wolf-bellied), the doer of terrible deeds, blew the great
conch Paundra."
1,16,1.16,"अनन्तविजयं राजा कुन्तीपुत्रो युधिष्ठिरः |
नकुलः सहदेवश्च सुघोषमणिपुष्पकौ ||१-१६||","anantavijayaṃ rājā kuntīputro yudhiṣṭhiraḥ .
nakulaḥ sahadevaśca sughoṣamaṇipuṣpakau ||1-16||","1.16. The king Yodhishthira, the son of Kunti, blew the Anantavijaya;
Nakula and Sahadeva blew the Sughosha and the Manipushpaka."
1,17,1.17,"काश्यश्च परमेष्वासः शिखण्डी च महारथः |
धृष्टद्युम्नो विराटश्च सात्यकिश्चापराजितः ||१-१७||","kāśyaśca parameṣvāsaḥ śikhaṇḍī ca mahārathaḥ .
dhṛṣṭadyumno virāṭaśca sātyakiścāparājitaḥ ||1-17||","1.17. The king of Kasi, an exellent archer, Sikhandi, the mighty
car-warrior, Dhrishtadyumna and Virata and Satyaki, the unconered."
1,18,1.18,"द्रुपदो द्रौपदेयाश्च सर्वशः पृथिवीपते |
सौभद्रश्च महाबाहुः शङ्खान्दध्मुः पृथक्पृथक् ||१-१८||","drupado draupadeyāśca sarvaśaḥ pṛthivīpate .
saubhadraśca mahābāhuḥ śaṅkhāndadhmuḥ pṛthakpṛthak ||1-18||","1.18. Drupada and the sons of Draupadi, O Lord of the earth, and
the son of Subhadra, the mighty-armed, blew their conches separately."
1,19,1.19,"स घोषो धार्तराष्ट्राणां हृदयानि व्यदारयत् |
नभश्च पृथिवीं चैव तुमुलोऽभ्यनुनादयन् (or लोव्यनु) ||१-१९||","sa ghoṣo dhārtarāṣṭrāṇāṃ hṛdayāni vyadārayat .
nabhaśca pṛthivīṃ caiva tumulo.abhyanunādayan (lo vyanu)||1-19||","1.19. That tumultuous sound rent the hearts of (the members of)
Dhritarashtra's party, making both the heaven and the earth resound."
1,20,1.20,"अथ व्यवस्थितान्दृष्ट्वा धार्तराष्ट्रान् कपिध्वजः |
प्रवृत्ते शस्त्रसम्पाते धनुरुद्यम्य पाण्डवः |
हृषीकेशं तदा वाक्यमिदमाह महीपते ||१-२०||","atha vyavasthitāndṛṣṭvā dhārtarāṣṭrān kapidhvajaḥ .
pravṛtte śastrasampāte dhanurudyamya pāṇḍavaḥ ||1-20||","1.20. Then, seeing the people of Dhritarashtra’s party standing
arrayed and the discharge of weapons about to begin, Arjuna, the son of
Pandu, whose ensign was a monkey, took up his bow and said the following
to Krishna, O Lord of the earth."
1,21,1.21,"अर्जुन उवाच |
सेनयोरुभयोर्मध्ये रथं स्थापय मेऽच्युत ||१-२१||","hṛṣīkeśaṃ tadā vākyamidamāha mahīpate .
arjuna uvāca .
senayorubhayormadhye rathaṃ sthāpaya me.acyuta ||1-21||","1.21 Arjuna said  In the middle between the two armies, place my chariot,
O krishna, so that I may behold those who stand here desirous to fight,
and know with whom I must fight, when the battle is about to commence."
1,22,1.22,"यावदेतान्निरीक्षेऽहं योद्धुकामानवस्थितान् |
कैर्मया सह योद्धव्यमस्मिन् रणसमुद्यमे ||१-२२||","yāvadetānnirikṣe.ahaṃ yoddhukāmānavasthitān .
kairmayā saha yoddhavyamasmin raṇasamudyame ||1-22||","1.22. Arjuna said  In the middle between the two armies, place my chariot,
O krishna, so that I may behold those who stand here desirous to fight,
and know with whom I must fight, when the battle is about to commence."
1,23,1.23,"योत्स्यमानानवेक्षेऽहं य एतेऽत्र समागताः |
धार्तराष्ट्रस्य दुर्बुद्धेर्युद्धे प्रियचिकीर्षवः ||१-२३||","yotsyamānānavekṣe.ahaṃ ya ete.atra samāgatāḥ .
dhārtarāṣṭrasya durbuddheryuddhe priyacikīrṣavaḥ ||1-23||","1.23. For I desire to observe those who are assembled here to fight,
wishing to please in battle the evil-minded Duryodhana (the son of Dhritarashtra)."
1,24,1.24,"सञ्जय उवाच |
एवमुक्तो हृषीकेशो गुडाकेशेन भारत |
सेनयोरुभयोर्मध्ये स्थापयित्वा रथोत्तमम् ||१-२४||","sañjaya uvāca .
evamukto hṛṣīkeśo guḍākeśena bhārata .
senayorubhayormadhye sthāpayitvā rathottamam ||1-24||","1.24. Sanjaya said  Thus addressed by Arjuna, Krishna, having stationed that
best of chariots, O Dhritarashtra, in the midst of the two armies."
1,25,1.25,"भीष्मद्रोणप्रमुखतः सर्वेषां च महीक्षिताम् |
उवाच पार्थ पश्यैतान्समवेतान्कुरूनिति ||१-२५||","bhīṣmadroṇapramukhataḥ sarveṣāṃ ca mahīkṣitām .
uvāca pārtha paśyaitānsamavetānkurūniti ||1-25||","1.25. In front of Bhishma and Drona, and all the rulers of the
earth, said: ""O Arjuna (son of Pritha), behold these Kurus gathered together."""
1,26,1.26,"तत्रापश्यत्स्थितान्पार्थः पितॄनथ पितामहान् |
आचार्यान्मातुलान्भ्रातॄन्पुत्रान्पौत्रान्सखींस्तथा ||१-२६||","tatrāpaśyatsthitānpārthaḥ pitṝnatha pitāmahān .
ācāryānmātulānbhrātṛnputrānpautrānsakhīṃstathā ||1-26||","1.26. Then, Arjuna (son of Pritha) saw there (in the armies) stationed,
fathers and grandfathers, teachers, maternal uncles, brothers, sons, grandsons
and friends too."
1,27,1.27,"श्वशुरान्सुहृदश्चैव सेनयोरुभयोरपि |
तान्समीक्ष्य स कौन्तेयः सर्वान्बन्धूनवस्थितान् ||१-२७||","śvaśurānsuhṛdaścaiva senayorubhayorapi .
tānsamīkṣya sa kaunteyaḥ sarvānbandhūnavasthitān ||1-27||","1.27. (He saw) fathers-in-law and friends also in both the armies.
The son of Kunti, Arjuna, seeing all those kinsmen thus standing arrayed,
spoke this, sorrowfully filled with deep pity."
1,28,1.28,"कृपया परयाविष्टो विषीदन्निदमब्रवीत् |
अर्जुन उवाच |
दृष्ट्वेमं स्वजनं कृष्ण युयुत्सुं समुपस्थितम् ||१-२८||","kṛpayā parayāviṣṭo viṣīdannidamabravīt .
arjuna uvāca .
dṛṣṭvemaṃ svajanaṃ kṛṣṇa yuyutsuṃ samupasthitam ||1-28||","1.28. Arjuna said  Seeing these, my kinsmen, O krishna, arrayed, eager to fight."
1,29,1.29,"सीदन्ति मम गात्राणि मुखं च परिशुष्यति |
वेपथुश्च शरीरे मे रोमहर्षश्च जायते ||१-२९||","sīdanti mama gātrāṇi mukhaṃ ca pariśuṣyati .
vepathuśca śarīre me romaharṣaśca jāyate ||1-29||","1.29. My limbs fail and my mouth is parched, my body ivers and
my hair stands on end."
1,30,1.30,"गाण्डीवं स्रंसते हस्तात्त्वक्चैव परिदह्यते |
न च शक्नोम्यवस्थातुं भ्रमतीव च मे मनः ||१-३०||","gāṇḍīvaṃ sraṃsate hastāttvakcaiva paridahyate .
na ca śaknomyavasthātuṃ bhramatīva ca me manaḥ ||1-30||","1.30. The (bow) Gandiva slips from my hand, and also my skins burns
all over; I am unable even to stand and my mind is reeling, as it were."
1,31,1.31,"निमित्तानि च पश्यामि विपरीतानि केशव |
न च श्रेयोऽनुपश्यामि हत्वा स्वजनमाहवे ||१-३१||","nimittāni ca paśyāmi viparītāni keśava .
na ca śreyo.anupaśyāmi hatvā svajanamāhave ||1-31||","1.31. And I see adverse omens, O Kesava. I do not see any good
in killing my kinsmen in battle."
1,32,1.32,"न काङ्क्षे विजयं कृष्ण न च राज्यं सुखानि च |
किं नो राज्येन गोविन्द किं भोगैर्जीवितेन वा ||१-३२||","na kāṅkṣe vijayaṃ kṛṣṇa na ca rājyaṃ sukhāni ca .
kiṃ no rājyena govinda kiṃ bhogairjīvitena vā ||1-32||","1.32. I desire not victory, O Krishna, nor kingdom, nor pleasures.
Of what avail is dominion to us, O Krishna, or pleasures or even life?"
1,33,1.33,"येषामर्थे काङ्क्षितं नो राज्यं भोगाः सुखानि च |
त इमेऽवस्थिता युद्धे प्राणांस्त्यक्त्वा धनानि च ||१-३३||","yeṣāmarthe kāṅkṣitaṃ no rājyaṃ bhogāḥ sukhāni ca .
ta ime.avasthitā yuddhe prāṇāṃstyaktvā dhanāni ca ||1-33||","1.33. Those for whose sake we desire kingdom, enjoyments and pleasures,
stand here in battle, having renounced life and wealth."
1,34,1.34,"आचार्याः पितरः पुत्रास्तथैव च पितामहाः |
मातुलाः श्वशुराः पौत्राः श्यालाः सम्बन्धिनस्तथा ||१-३४||","ācāryāḥ pitaraḥ putrāstathaiva ca pitāmahāḥ .
mātulāḥ śvaśurāḥ pautrāḥ śyālāḥ sambandhinastathā ||1-34||","1.34. Teachers, fathers, sons and also grandfathers, maternal uncles,
fathers-in-law, grandsons, brothers-in-law and other relatives,-"
1,35,1.35,"एतान्न हन्तुमिच्छामि घ्नतोऽपि मधुसूदन |
अपि त्रैलोक्यराज्यस्य हेतोः किं नु महीकृते ||१-३५||","etānna hantumicchāmi ghnato.api madhusūdana .
api trailokyarājyasya hetoḥ kiṃ nu mahīkṛte ||1-35||","1.35. These I do not wish to kill, though they kill me, O Krishna,
even for the sake of dominion over the three worlds; leave alone killing
them for the sake of the earth."
1,36,1.36,"निहत्य धार्तराष्ट्रान्नः का प्रीतिः स्याज्जनार्दन |
पापमेवाश्रयेदस्मान्हत्वैतानाततायिनः ||१-३६||","nihatya dhārtarāṣṭrānnaḥ kā prītiḥ syājjanārdana .
pāpamevāśrayedasmānhatvaitānātatāyinaḥ ||1-36||","1.36. By killing these sons of Dhritarashtra, what pleasure can
be ours, O Janardana? Only sin will accrue to us from killing these felons."
1,37,1.37,"तस्मान्नार्हा वयं हन्तुं धार्तराष्ट्रान्स्वबान्धवान् |
स्वजनं हि कथं हत्वा सुखिनः स्याम माधव ||१-३७||","tasmānnārhā vayaṃ hantuṃ dhārtarāṣṭrānsvabāndhavān .
svajanaṃ hi kathaṃ hatvā sukhinaḥ syāma mādhava ||1-37||","1.37. Therefore, we should not kill the sons of Dhritarashtra,
our relatives; for how can we be happy by killing our own people, O Madhava
(Krishna)?"
1,38,1.38,"यद्यप्येते न पश्यन्ति लोभोपहतचेतसः |
कुलक्षयकृतं दोषं मित्रद्रोहे च पातकम् ||१-३८||","yadyapyete na paśyanti lobhopahatacetasaḥ .
kulakṣayakṛtaṃ doṣaṃ mitradrohe ca pātakam ||1-38||","1.38. Though they, with intelligence overpowered by greed, see
no evil in the destruction of families, and no sin in hostility to friends,"
1,39,1.39,"कथं न ज्ञेयमस्माभिः पापादस्मान्निवर्तितुम् |
कुलक्षयकृतं दोषं प्रपश्यद्भिर्जनार्दन ||१-३९||","kathaṃ na jñeyamasmābhiḥ pāpādasmānnivartitum .
kulakṣayakṛtaṃ doṣaṃ prapaśyadbhirjanārdana ||1-39||","1.39. Why should not we who clearly see evil in the destruction
of families, learn to turn away from this sin, O Janardana (Krishna)?"
1,40,1.40,"कुलक्षये प्रणश्यन्ति कुलधर्माः सनातनाः |
धर्मे नष्टे कुलं कृत्स्नमधर्मोऽभिभवत्युत ||१-४०||","kulakṣaye praṇaśyanti kuladharmāḥ sanātanāḥ .
dharme naṣṭe kulaṃ kṛtsnamadharmo.abhibhavatyuta ||1-40||","1.40. In the destruction of a family, the immemorial religious
rites of that family perish; on the destruction of spirituality, impiety,
indeed, overcomes the whole family."
1,41,1.41,"अधर्माभिभवात्कृष्ण प्रदुष्यन्ति कुलस्त्रियः |
स्त्रीषु दुष्टासु वार्ष्णेय जायते वर्णसङ्करः ||१-४१||","adharmābhibhavātkṛṣṇa praduṣyanti kulastriyaḥ .
strīṣu duṣṭāsu vārṣṇeya jāyate varṇasaṅkaraḥ ||1-41||","1.41. By the prevalence of impiety, O Krishna, the women of
the family become corrupt; and , women being corrupted, O Varshenya (descendant
of Vrishni), there arises intermingling of castes."
1,42,1.42,"सङ्करो नरकायैव कुलघ्नानां कुलस्य च |
पतन्ति पितरो ह्येषां लुप्तपिण्डोदकक्रियाः ||१-४२||","saṅkaro narakāyaiva kulaghnānāṃ kulasya ca .
patanti pitaro hyeṣāṃ luptapiṇḍodakakriyāḥ ||1-42||","1.42. Confusion of castes leads to hell the slayers of the family,
for their forefathers fall, deprived of the offerings of rice-ball and
water (libations)."
1,43,1.43,"दोषैरेतैः कुलघ्नानां वर्णसङ्करकारकैः |
उत्साद्यन्ते जातिधर्माः कुलधर्माश्च शाश्वताः ||१-४३||","doṣairetaiḥ kulaghnānāṃ varṇasaṅkarakārakaiḥ .
utsādyante jātidharmāḥ kuladharmāśca śāśvatāḥ ||1-43||","1.43. By these evil deeds of the destroyers of the family, which
cause confusion of castes, the eternal religious rites of the caste and
the family are destroyed."
1,44,1.44,"उत्सन्नकुलधर्माणां मनुष्याणां जनार्दन |
नरके नियतं वासो भवतीत्यनुशुश्रुम (or नरकेऽनियतं) ||१-४४||","utsannakuladharmāṇāṃ manuṣyāṇāṃ janārdana .
narake niyataṃ vāso bhavatītyanuśuśruma ||1-44||","1.44. We have heard, O Janardana, that inevitable is the dwelling
for an unknown period in hell for those men in whose families the religious
practices have been destroyed."
1,45,1.45,"अहो बत महत्पापं कर्तुं व्यवसिता वयम् |
यद्राज्यसुखलोभेन हन्तुं स्वजनमुद्यताः ||१-४५||","aho bata mahatpāpaṃ kartuṃ vyavasitā vayam .
yadrājyasukhalobhena hantuṃ svajanamudyatāḥ ||1-45||","1.45. Alas! We are involved in a great sin, in that we are
prepared to kill our kinsmen, through greed for the pleasures of a kingdom."
1,46,1.46,"यदि मामप्रतीकारमशस्त्रं शस्त्रपाणयः |
धार्तराष्ट्रा रणे हन्युस्तन्मे क्षेमतरं भवेत् ||१-४६||","yadi māmapratīkāramaśastraṃ śastrapāṇayaḥ .
dhārtarāṣṭrā raṇe hanyustanme kṣemataraṃ bhavet ||1-46||","1.46. If the sons of Dhritarashtra with weapons in hand should
slay me in battle, unresisting and unarmed, that would be better for me."
1,47,1.47,"सञ्जय उवाच |
एवमुक्त्वार्जुनः सङ्ख्ये रथोपस्थ उपाविशत् |
विसृज्य सशरं चापं शोकसंविग्नमानसः ||१-४७||","sañjaya uvāca .
evamuktvārjunaḥ saṅkhye rathopastha upāviśat .
visṛjya saśaraṃ cāpaṃ śokasaṃvignamānasaḥ ||1-47||","1.47. Sanjaya said  Having thus spoken in the midst of the battlefield, Arjuna,
casting away his bow and arrow, sat down on the seat of the chariot with
his mind overwhelmed with sorrow."
2,1,2.1,"सञ्जय उवाच |
तं तथा कृपयाविष्टमश्रुपूर्णाकुलेक्षणम् |
विषीदन्तमिदं वाक्यमुवाच मधुसूदनः ||२-१||","sañjaya uvāca .
taṃ tathā kṛpayāviṣṭamaśrupūrṇākulekṣaṇam .
viṣīdantamidaṃ vākyamuvāca madhusūdanaḥ ||2-1||","2.1 Sanjaya said  To him who was thus overcome with pity and who was despondent, with eyes full of tears and agitated, Madhusudana (the destroyer of Madhu) or Krishna spoke these words."
