chapter,verse,verse_id,sanskrit,transliteration,translation
10,7,10.7,"एतां विभूतिं योगं च मम यो वेत्ति तत्त्वतः |
सोऽविकम्पेन योगेन युज्यते नात्र संशयः ||१०-७||","etāṃ vibhūtiṃ yogaṃ ca mama yo vetti tattvataḥ .
so.avikampena yogena yujyate nātra saṃśayaḥ ||10-7||",10.7 He who in truth knows these manifold manifestations of My Being and (this) Yoga-power of Mine becomes established in the unshakable Yoga; there is no doubt about it.
10,8,10.8,"अहं सर्वस्य प्रभवो मत्तः सर्वं प्रवर्तते |
इति मत्वा भजन्ते मां बुधा भावसमन्विताः ||१०-८||","ahaṃ sarvasya prabhavo mattaḥ sarvaṃ pravartate .
iti matvā bhajante māṃ budhā bhāvasamanvitāḥ ||10-8||","10.8 I am the source of all; from Me everything evolves; understanding thus, the wise, endowed with meditation, worship Me."
10,9,10.9,"मच्चित्ता मद्गतप्राणा बोधयन्तः परस्परम् |
कथयन्तश्च मां नित्यं तुष्यन्ति च रमन्ति च ||१०-९||","maccittā madgataprāṇā bodhayantaḥ parasparam .
kathayantaśca māṃ nityaṃ tuṣyanti ca ramanti ca ||10-9||","10.9 With their mind and their life wholly absorbed in Me, enlightening each other and ever speaking of Me, they are satisfied and delighted."
10,10,10.10,"तेषां सततयुक्तानां भजतां प्रीतिपूर्वकम् |
ददामि बुद्धियोगं तं येन मामुपयान्ति ते ||१०-१०||","teṣāṃ satatayuktānāṃ bhajatāṃ prītipūrvakam .
dadāmi buddhiyogaṃ taṃ yena māmupayānti te ||10-10||","10.10 To them who are ever steadfast, worshipping Me with love, I give the Yoga of discrimination by which they come to Me."
10,11,10.11,"तेषामेवानुकम्पार्थमहमज्ञानजं तमः |
नाशयाम्यात्मभावस्थो ज्ञानदीपेन भास्वता ||१०-११||","teṣāmevānukampārthamahamajñānajaṃ tamaḥ .
nāśayāmyātmabhāvastho jñānadīpena bhāsvatā ||10-11||","10.11 Out of mere compassion for them, I, dwelling within their Self, destroy the darkness born of ignorance by the luminous lamp of knowledge."
10,12,10.12,"अर्जुन उवाच |
परं ब्रह्म परं धाम पवित्रं परमं भवान् |
पुरुषं शाश्वतं दिव्यमादिदेवमजं विभुम् ||१०-१२||","arjuna uvāca .
paraṃ brahma paraṃ dhāma pavitraṃ paramaṃ bhavān .
puruṣaṃ śāśvataṃ divyamādidevamajaṃ vibhum ||10-12||","10.12 Arjuna said  Thou art the Supreme Brahman, the supreme abode (or the supreme light), the supreme purifier, eternal, divine Person, the primeval God, unborn andn omnipresent."
10,13,10.13,"आहुस्त्वामृषयः सर्वे देवर्षिर्नारदस्तथा |
असितो देवलो व्यासः स्वयं चैव ब्रवीषि मे ||१०-१३||","āhustvāmṛṣayaḥ sarve devarṣirnāradastathā .
asito devalo vyāsaḥ svayaṃ caiva bravīṣi me ||10-13||","10.13 All the sages have thus declared Thee, as also the divine sage Narada; so also Asita, Devala and Vyasa; and now Thou Thyself sayest so to me."
10,14,10.14,"सर्वमेतदृतं मन्ये यन्मां वदसि केशव |
न हि ते भगवन्व्यक्तिं विदुर्देवा न दानवाः ||१०-१४||","sarvametadṛtaṃ manye yanmāṃ vadasi keśava .
na hi te bhagavanvyaktiṃ vidurdevā na dānavāḥ ||10-14||","10.14 I believe all this that Thou sayest to me to be true, O Krishna; verily, O blessed Lord! neither the gods nor the demons know Thy manifestation (origin)."
10,15,10.15,"स्वयमेवात्मनात्मानं वेत्थ त्वं पुरुषोत्तम |
भूतभावन भूतेश देवदेव जगत्पते ||१०-१५||","svayamevātmanātmānaṃ vettha tvaṃ puruṣottama .
bhūtabhāvana bhūteśa devadeva jagatpate ||10-15||",Swami Sivananda did not comment on this sloka
10,16,10.16,"वक्तुमर्हस्यशेषेण दिव्या ह्यात्मविभूतयः |
याभिर्विभूतिभिर्लोकानिमांस्त्वं व्याप्य तिष्ठसि ||१०-१६||","vaktumarhasyaśeṣeṇa divyā hyātmavibhūtayaḥ .
yābhirvibhūtibhirlokānimāṃstvaṃ vyāpya tiṣṭhasi ||10-16||","10.16 Thou shouldst indeed tell, without reserve, of Thy divine glories by which Thou existest, pervading all these worlds. (None else can do so.)"
10,17,10.17,"कथं विद्यामहं योगिंस्त्वां सदा परिचिन्तयन् |
केषु केषु च भावेषु चिन्त्योऽसि भगवन्मया ||१०-१७||","kathaṃ vidyāmahaṃ yogiṃstvāṃ sadā paricintayan .
keṣu keṣu ca bhāveṣu cintyo.asi bhagavanmayā ||10-17||","10.17 How shall I, ever meditating, know Thee, O Yogin? In what aspects or things, O blessed 
Lord, art Thou to be thought of by me?"
10,18,10.18,"विस्तरेणात्मनो योगं विभूतिं च जनार्दन |
भूयः कथय तृप्तिर्हि शृण्वतो नास्ति मेऽमृतम् ||१०-१८||","vistareṇātmano yogaṃ vibhūtiṃ ca janārdana .
bhūyaḥ kathaya tṛptirhi śṛṇvato nāsti me.amṛtam ||10-18||","10.18 Tell me again in detail, O Krishna, of Thy Yogic power and glory; for I am not satiated with what I have heard of Thy life-giving and nectar-like speech."
10,19,10.19,"श्रीभगवानुवाच |
हन्त ते कथयिष्यामि दिव्या ह्यात्मविभूतयः |
प्राधान्यतः कुरुश्रेष्ठ नास्त्यन्तो विस्तरस्य मे ||१०-१९||","śrībhagavānuvāca .
hanta te kathayiṣyāmi divyā hyātmavibhūtayaḥ .
prādhānyataḥ kuruśreṣṭha nāstyanto vistarasya me ||10-19||","10.19 The Blessed Lord said  Very well! Now I will declare to thee My divine glories in their prominence, O Arjuna; there is no end to their detailed description."
10,20,10.20,"अहमात्मा गुडाकेश सर्वभूताशयस्थितः |
अहमादिश्च मध्यं च भूतानामन्त एव च ||१०-२०||","ahamātmā guḍākeśa sarvabhūtāśayasthitaḥ .
ahamādiśca madhyaṃ ca bhūtānāmanta eva ca ||10-20||","10.20 I am the Self, O Gudakesa, seated in the hearts of all beings; I am the beginning, the middle and also the end of all beings."
10,21,10.21,"आदित्यानामहं विष्णुर्ज्योतिषां रविरंशुमान् |
मरीचिर्मरुतामस्मि नक्षत्राणामहं शशी ||१०-२१||","ādityānāmahaṃ viṣṇurjyotiṣāṃ raviraṃśumān .
marīcirmarutāmasmi nakṣatrāṇāmahaṃ śaśī ||10-21||","10.21 Among the (twelve) Adityas, I am Vishnu; among luminaries, the radiant sun; I am Marichi among the (seven or forty-nine) Maruts; among stars the moon am I."
10,22,10.22,"वेदानां सामवेदोऽस्मि देवानामस्मि वासवः |
इन्द्रियाणां मनश्चास्मि भूतानामस्मि चेतना ||१०-२२||","vedānāṃ sāmavedo.asmi devānāmasmi vāsavaḥ .
indriyāṇāṃ manaścāsmi bhūtānāmasmi cetanā ||10-22||",10.22 Among the Vedas I am the Sama-Veda; I am Vasava among the gods; among the senses I am the mind; and I am intelligence among living beings.
10,23,10.23,"रुद्राणां शङ्करश्चास्मि वित्तेशो यक्षरक्षसाम् |
वसूनां पावकश्चास्मि मेरुः शिखरिणामहम् ||१०-२३||","rudrāṇāṃ śaṅkaraścāsmi vitteśo yakṣarakṣasām .
vasūnāṃ pāvakaścāsmi meruḥ śikhariṇāmaham ||10-23||","10.23 And, among the Rudras I am Sankara; among the Yakshas and Rakshasas, the Lord of wealth (Kubera); among the Vasus I am Pavaka (fire); and among the (seven) mountains I am the Meru."
10,24,10.24,"पुरोधसां च मुख्यं मां विद्धि पार्थ बृहस्पतिम् |
सेनानीनामहं स्कन्दः सरसामस्मि सागरः ||१०-२४||","purodhasāṃ ca mukhyaṃ māṃ viddhi pārtha bṛhaspatim .
senānīnāmahaṃ skandaḥ sarasāmasmi sāgaraḥ ||10-24||","10.24 And, among the household priests (of kings), O Arjuna, know Me to be the chief, Brihaspati; among the army generals I am Skana; among lakes I am the ocean.
'"
10,25,10.25,"महर्षीणां भृगुरहं गिरामस्म्येकमक्षरम् |
यज्ञानां जपयज्ञोऽस्मि स्थावराणां हिमालयः ||१०-२५||","maharṣīṇāṃ bhṛgurahaṃ girāmasmyekamakṣaram .
yajñānāṃ japayajño.asmi sthāvarāṇāṃ himālayaḥ ||10-25||",10.25 Among the great sages I am Bhrigu; among words I am the one syllable (Om); among sacrifices I am the sacrifice of silent repetition; among the immovable things I am the Himalayas.
10,26,10.26,"अश्वत्थः सर्ववृक्षाणां देवर्षीणां च नारदः |
गन्धर्वाणां चित्ररथः सिद्धानां कपिलो मुनिः ||१०-२६||","aśvatthaḥ sarvavṛkṣāṇāṃ devarṣīṇāṃ ca nāradaḥ .
gandharvāṇāṃ citrarathaḥ siddhānāṃ kapilo muniḥ ||10-26||","10.26 Among all the trees ( I am) the Peepul; among the divine sages, I am Narada; among Gandharvas, Chitraratha; among the perfected, the sage Kapila."
10,27,10.27,"उच्चैःश्रवसमश्वानां विद्धि माममृतोद्भवम् |
ऐरावतं गजेन्द्राणां नराणां च नराधिपम् ||१०-२७||","uccaiḥśravasamaśvānāṃ viddhi māmamṛtodbhavam .
airāvataṃ gajendrāṇāṃ narāṇāṃ ca narādhipam ||10-27||","10.27 Know Me as Ucchaisravas born of nectar, among horses; among lordly elephants (I am) the Airavata; and, among men, the king."
10,28,10.28,"आयुधानामहं वज्रं धेनूनामस्मि कामधुक् |
प्रजनश्चास्मि कन्दर्पः सर्पाणामस्मि वासुकिः ||१०-२८||","āyudhānāmahaṃ vajraṃ dhenūnāmasmi kāmadhuk .
prajanaścāsmi kandarpaḥ sarpāṇāmasmi vāsukiḥ ||10-28||","10.28 Among weapons I am the thunderbolt; among cows I am the wish-fulfilling cow called Kamadhenu; I am the progenitor, the god of love; among serpents I am Vasuki."
10,29,10.29,"अनन्तश्चास्मि नागानां वरुणो यादसामहम् |
पितॄणामर्यमा चास्मि यमः संयमतामहम् ||१०-२९||","anantaścāsmi nāgānāṃ varuṇo yādasāmaham .
pitṝṇāmaryamā cāsmi yamaḥ saṃyamatāmaham ||10-29||",10.29 I am Ananta among the Nagas; I am Varuna among water-deities; Aryaman among the Manes I am; I am Yama among the governors.
10,30,10.30,"प्रह्लादश्चास्मि दैत्यानां कालः कलयतामहम् |
मृगाणां च मृगेन्द्रोऽहं वैनतेयश्च पक्षिणाम् ||१०-३०||","prahlādaścāsmi daityānāṃ kālaḥ kalayatāmaham .
mṛgāṇāṃ ca mṛgendro.ahaṃ vainateyaśca pakṣiṇām ||10-30||","10.30 And, I am Prahlada among the demons, among the reckoners I am time; among beasts I am the lion, and Vainateya (Garuda) among birds."
10,31,10.31,"पवनः पवतामस्मि रामः शस्त्रभृतामहम् |
झषाणां मकरश्चास्मि स्रोतसामस्मि जाह्नवी ||१०-३१||","pavanaḥ pavatāmasmi rāmaḥ śastrabhṛtāmaham .
jhaṣāṇāṃ makaraścāsmi srotasāmasmi jāhnavī ||10-31||",10.31 Among the purifiers (or the speeders) I am the wind; Rama among the warriors am I; among the fishes I am the shark; among the streams I am the Ganga.
10,32,10.32,"सर्गाणामादिरन्तश्च मध्यं चैवाहमर्जुन |
अध्यात्मविद्या विद्यानां वादः प्रवदतामहम् ||१०-३२||","sargāṇāmādirantaśca madhyaṃ caivāhamarjuna .
adhyātmavidyā vidyānāṃ vādaḥ pravadatāmaham ||10-32||","10.32 Among creations I am the beginning, the middle and also the end, O Arjuna; among the sciences I am the science of the Self; and I am the logic among controversialists."
10,33,10.33,"अक्षराणामकारोऽस्मि द्वन्द्वः सामासिकस्य च |
अहमेवाक्षयः कालो धाताहं विश्वतोमुखः ||१०-३३||","akṣarāṇāmakāro.asmi dvandvaḥ sāmāsikasya ca .
ahamevākṣayaḥ kālo dhātāhaṃ viśvatomukhaḥ ||10-33||","10.33 Among the letters of the alphabets, the letter 'A' I am and the dual among the compounds. I am verily the inexhaustible or everlasting time; I am the dispenser (of the fruits of actions) having 
faces in all directions."
10,34,10.34,"मृत्युः सर्वहरश्चाहमुद्भवश्च भविष्यताम् |
कीर्तिः श्रीर्वाक्च नारीणां स्मृतिर्मेधा धृतिः क्षमा ||१०-३४||","mṛtyuḥ sarvaharaścāhamudbhavaśca bhaviṣyatām .
kīrtiḥ śrīrvākca nārīṇāṃ smṛtirmedhā dhṛtiḥ kṣamā ||10-34||","10.34 And I am the all-devouring Death, and the prosperity of those who are to be prosperous; among the feminine alities (I am) fame, prosperity, speech, memory, intelligence, firmness and forgiveness."
10,35,10.35,"बृहत्साम तथा साम्नां गायत्री छन्दसामहम् |
मासानां मार्गशीर्षोऽहमृतूनां कुसुमाकरः ||१०-३५||","bṛhatsāma tathā sāmnāṃ gāyatrī chandasāmaham .
māsānāṃ mārgaśīrṣo.ahamṛtūnāṃ kusumākaraḥ ||10-35||",10.35 Among the hymns also I am the Brihatsaman; among metres Gayatri am I; among the montsh I am the Margasirsha; among the seasons (I am) the flowery season.
10,36,10.36,"द्यूतं छलयतामस्मि तेजस्तेजस्विनामहम् |
जयोऽस्मि व्यवसायोऽस्मि सत्त्वं सत्त्ववतामहम् ||१०-३६||","dyūtaṃ chalayatāmasmi tejastejasvināmaham .
jayo.asmi vyavasāyo.asmi sattvaṃ sattvavatāmaham ||10-36||",10.36 I am the gambling of the fraudulent; I am the splendour of the splendid; I am victory; I am determination (of those who are determined); I am the goodness of the good.
10,37,10.37,"वृष्णीनां वासुदेवोऽस्मि पाण्डवानां धनञ्जयः |
मुनीनामप्यहं व्यासः कवीनामुशना कविः ||१०-३७||","vṛṣṇīnāṃ vāsudevo.asmi pāṇḍavānāṃ dhanañjayaḥ .
munīnāmapyahaṃ vyāsaḥ kavīnāmuśanā kaviḥ ||10-37||","10.37 Among the Vrishnis I am Vaasudeva; among the Pandavas I am Arjuna; among the sages I am Vyasa; among the Poets I am Usanas, the poet."
10,38,10.38,"दण्डो दमयतामस्मि नीतिरस्मि जिगीषताम् |
मौनं चैवास्मि गुह्यानां ज्ञानं ज्ञानवतामहम् ||१०-३८||","daṇḍo damayatāmasmi nītirasmi jigīṣatām .
maunaṃ caivāsmi guhyānāṃ jñānaṃ jñānavatāmaham ||10-38||","10.38 Of those who punish, I am the sceptre; among those who seek victory, I am statesmanship; and also among secrets, I am silence; knowledge among knowers I am."
10,39,10.39,"यच्चापि सर्वभूतानां बीजं तदहमर्जुन |
न तदस्ति विना यत्स्यान्मया भूतं चराचरम् ||१०-३९||","yaccāpi sarvabhūtānāṃ bījaṃ tadahamarjuna .
na tadasti vinā yatsyānmayā bhūtaṃ carācaram ||10-39||","10.39 And whatever is the seed of all beings, that also am I, O Arjuna; there is no being, whether moving or unmoving, that can exist without Me."
10,40,10.40,"नान्तोऽस्ति मम दिव्यानां विभूतीनां परन्तप |
एष तूद्देशतः प्रोक्तो विभूतेर्विस्तरो मया ||१०-४०||","nānto.asti mama divyānāṃ vibhūtīnāṃ parantapa .
eṣa tūddeśataḥ prokto vibhūtervistaro mayā ||10-40||","10.40 There is no end to My divine gloreis, O Arjuna, but this is a brief statement by Me of the particulars of My divine glories."
10,41,10.41,"यद्यद्विभूतिमत्सत्त्वं श्रीमदूर्जितमेव वा |
तत्तदेवावगच्छ त्वं मम तेजोंऽशसम्भवम् ||१०-४१||","yadyadvibhūtimatsattvaṃ śrīmadūrjitameva vā .
tattadevāvagaccha tvaṃ mama tejoṃśasambhavam ||10-41||","10.41 Whatever being there is glorious, prosperous or powerful, that know thou to be a manifestation of a part of My splendour."
10,42,10.42,"अथवा बहुनैतेन किं ज्ञातेन तवार्जुन |
विष्टभ्याहमिदं कृत्स्नमेकांशेन स्थितो जगत् ||१०-४२||","athavā bahunaitena kiṃ jñātena tavārjuna .
viṣṭabhyāhamidaṃ kṛtsnamekāṃśena sthito jagat ||10-42||","10.42 But, of what avail to thee is the knowledge of all these details, O Arjuna? I exist, supporting this whole world by one part of Myself."
11,1,11.1,"अर्जुन उवाच |
मदनुग्रहाय परमं गुह्यमध्यात्मसंज्ञितम् |
यत्त्वयोक्तं वचस्तेन मोहोऽयं विगतो मम ||११-१||","arjuna uvāca .
madanugrahāya paramaṃ guhyamadhyātmasaṃjñitam .
yattvayoktaṃ vacastena moho.ayaṃ vigato mama ||11-1||","11.1 Arjuna said  By this word (explanation) of the highest secret concerning the Self which Thou hast spoken, for the sake of blessing me, my delusion is gone."
11,2,11.2,"भवाप्ययौ हि भूतानां श्रुतौ विस्तरशो मया |
त्वत्तः कमलपत्राक्ष माहात्म्यमपि चाव्ययम् ||११-२||","bhavāpyayau hi bhūtānāṃ śrutau vistaraśo mayā .
tvattaḥ kamalapatrākṣa māhātmyamapi cāvyayam ||11-2||","11.2 The origin and the destruction of beings verily have been heard by me in detail from Thee, O lotus-eyed Lord, and also Thy inexhaustible greatness."
11,3,11.3,"एवमेतद्यथात्थ त्वमात्मानं परमेश्वर |
द्रष्टुमिच्छामि ते रूपमैश्वरं पुरुषोत्तम ||११-३||","evametadyathāttha tvamātmānaṃ parameśvara .
draṣṭumicchāmi te rūpamaiśvaraṃ puruṣottama ||11-3||","11.3 (Now) O Supreme Lord, as Thou hast thus described Thyself, O Supreme Person, I wish to see Thy divine form."
11,4,11.4,"मन्यसे यदि तच्छक्यं मया द्रष्टुमिति प्रभो |
योगेश्वर ततो मे त्वं दर्शयात्मानमव्ययम् ||११-४||","manyase yadi tacchakyaṃ mayā draṣṭumiti prabho .
yogeśvara tato me tvaṃ darśayātmānamavyayam ||11-4||","11.4 If Thou, O Lord, thinkest it possible for me to see it, do Thou, then, O Lord of the Yogins, show me Thy imperishable Self."
11,5,11.5,"श्रीभगवानुवाच |
पश्य मे पार्थ रूपाणि शतशोऽथ सहस्रशः |
नानाविधानि दिव्यानि नानावर्णाकृतीनि च ||११-५||","śrībhagavānuvāca .
paśya me pārtha rūpāṇi śataśo.atha sahasraśaḥ .
nānāvidhāni divyāni nānāvarṇākṛtīni ca ||11-5||","11.5 The Blessed Lord said  Behold, O Arjuna, forms of Mine, by the hundreds and thousands, of different sorts, divine, and of various colours and shapes."
11,6,11.6,"पश्यादित्यान्वसून्रुद्रानश्विनौ मरुतस्तथा |
बहून्यदृष्टपूर्वाणि पश्याश्चर्याणि भारत ||११-६||","paśyādityānvasūnrudrānaśvinau marutastathā .
bahūnyadṛṣṭapūrvāṇi paśyāścaryāṇi bhārata ||11-6||","11.6 Behold the Adityas, the Vasus, the Rudras, the two Asvins and also the Maruts; behold many wonders never seen before, O Arjuna."
11,7,11.7,"इहैकस्थं जगत्कृत्स्नं पश्याद्य सचराचरम् |
मम देहे गुडाकेश यच्चान्यद् द्रष्टुमिच्छसि ||११-७||","ihaikasthaṃ jagatkṛtsnaṃ paśyādya sacarācaram .
mama dehe guḍākeśa yaccānyad draṣṭumicchasi ||11-7||","11.7 Now behold, O Arjuna, in this, My body, the whole universe centred in one  including the moving and the unmoving  and whatever else thou desirest to see."
11,8,11.8,"न तु मां शक्यसे द्रष्टुमनेनैव स्वचक्षुषा |
दिव्यं ददामि ते चक्षुः पश्य मे योगमैश्वरम् ||११-८||","na tu māṃ śakyase draṣṭumanenaiva svacakṣuṣā .
divyaṃ dadāmi te cakṣuḥ paśya me yogamaiśvaram ||11-8||",11.8 But thou art not able to behold Me with these thine own eyes; I give thee the divine eye; behold My lordly Yoga.
11,9,11.9,"सञ्जय उवाच |
एवमुक्त्वा ततो राजन्महायोगेश्वरो हरिः |
दर्शयामास पार्थाय परमं रूपमैश्वरम् ||११-९||","sañjaya uvāca .
evamuktvā tato rājanmahāyogeśvaro hariḥ .
darśayāmāsa pārthāya paramaṃ rūpamaiśvaram ||11-9||","11.9 Sanjaya said  Having thus spoken, O king, the great Lord of Yoga, hari (Krishna), showed to Arjuna His supreme form as the Lord."
11,10,11.10,"अनेकवक्त्रनयनमनेकाद्भुतदर्शनम् |
अनेकदिव्याभरणं दिव्यानेकोद्यतायुधम् ||११-१०||","anekavaktranayanamanekādbhutadarśanam .
anekadivyābharaṇaṃ divyānekodyatāyudham ||11-10||","11.10 With numerous mouths and eyes, with numerous wonderful sights, with numerous divine ornaments, with numerous divine weapons uplifted (such a form He showed)."
11,11,11.11,"दिव्यमाल्याम्बरधरं दिव्यगन्धानुलेपनम् |
सर्वाश्चर्यमयं देवमनन्तं विश्वतोमुखम् ||११-११||","divyamālyāmbaradharaṃ divyagandhānulepanam .
sarvāścaryamayaṃ devamanantaṃ viśvatomukham ||11-11||","11.11 Wearing divine garlands (necklaces) and apparel, anointed with divine unguents, the all-wonderful, resplendent (Being) endless with faces on all sides."
11,12,11.12,"दिवि सूर्यसहस्रस्य भवेद्युगपदुत्थिता |
यदि भाः सदृशी सा स्याद्भासस्तस्य महात्मनः ||११-१२||","divi sūryasahasrasya bhavedyugapadutthitā .
yadi bhāḥ sadṛśī sā syādbhāsastasya mahātmanaḥ ||11-12||","11.12 If the splendour of a thousand suns were to blaze out at once (simultaneously) in the sky, that would be the splendour of that mighty Being (great Soul)."
