chapter,verse,verse_id,sanskrit,transliteration,translation
13,21,13.21,"कार्यकारणकर्तृत्वे हेतुः प्रकृतिरुच्यते |
पुरुषः सुखदुःखानां भोक्तृत्वे हेतुरुच्यते ||१३-२१||","kāryakāraṇakartṛtve hetuḥ prakṛtirucyate .
puruṣaḥ sukhaduḥkhānāṃ bhoktṛtve heturucyate ||13-21||","13.21 In the production of the effect and the cause, Nature (matter) is said to be the cause; in the experience of pleasure and pain, the soul is said to be the cause."
13,22,13.22,"पुरुषः प्रकृतिस्थो हि भुङ्क्ते प्रकृतिजान्गुणान् |
कारणं गुणसङ्गोऽस्य सदसद्योनिजन्मसु ||१३-२२||","puruṣaḥ prakṛtistho hi bhuṅkte prakṛtijānguṇān .
kāraṇaṃ guṇasaṅgo.asya sadasadyonijanmasu ||13-22||",13.22 The soul seated in Nature experiences the alities born of Nature; attachment to the alities is the cause of its birth in good and evil wombs.
13,23,13.23,"उपद्रष्टानुमन्ता च भर्ता भोक्ता महेश्वरः |
परमात्मेति चाप्युक्तो देहेऽस्मिन्पुरुषः परः ||१३-२३||","upadraṣṭānumantā ca bhartā bhoktā maheśvaraḥ .
paramātmeti cāpyukto dehe.asminpuruṣaḥ paraḥ ||13-23||","13.23 The Supreme Soul in this body is also called the spectator, the permitter, the supporter, the enjoyer, the great Lord and the Supreme Self."
13,24,13.24,"य एवं वेत्ति पुरुषं प्रकृतिं च गुणैः सह |
सर्वथा वर्तमानोऽपि न स भूयोऽभिजायते ||१३-२४||","ya evaṃ vetti puruṣaṃ prakṛtiṃ ca guṇaiḥ saha .
sarvathā vartamāno.api na sa bhūyo.abhijāyate ||13-24||","13.24 He who thus knows the Spirit and Matter together with the alities, in whatever condition he may be, he is not born again."
13,25,13.25,"ध्यानेनात्मनि पश्यन्ति केचिदात्मानमात्मना |
अन्ये साङ्ख्येन योगेन कर्मयोगेन चापरे ||१३-२५||","dhyānenātmani paśyanti kecidātmānamātmanā .
anye sāṅkhyena yogena karmayogena cāpare ||13-25||","13.25 Some by meditation behold the Self in the self by the self, others by the Yoga of knowledge, and still others by the Yoga of action."
13,26,13.26,"अन्ये त्वेवमजानन्तः श्रुत्वान्येभ्य उपासते |
तेऽपि चातितरन्त्येव मृत्युं श्रुतिपरायणाः ||१३-२६||","anye tvevamajānantaḥ śrutvānyebhya upāsate .
te.api cātitarantyeva mṛtyuṃ śrutiparāyaṇāḥ ||13-26||","13.26 Others also, not knowing thus, worship, having heard of It from others; they, too, cross beyond death, regarding what they have heard as the Supreme refuge."
13,27,13.27,"यावत्सञ्जायते किञ्चित्सत्त्वं स्थावरजङ्गमम् |
क्षेत्रक्षेत्रज्ञसंयोगात्तद्विद्धि भरतर्षभ ||१३-२७||","yāvatsañjāyate kiñcitsattvaṃ sthāvarajaṅgamam .
kṣetrakṣetrajñasaṃyogāttadviddhi bharatarṣabha ||13-27||","13.27 Wherever a being is born, whether unmoving or moving, know thou, O best of the Bharatas (Arjuna), that it is from the union between the field and its knower."
13,28,13.28,"समं सर्वेषु भूतेषु तिष्ठन्तं परमेश्वरम् |
विनश्यत्स्वविनश्यन्तं यः पश्यति स पश्यति ||१३-२८||","samaṃ sarveṣu bhūteṣu tiṣṭhantaṃ parameśvaram .
vinaśyatsvavinaśyantaṃ yaḥ paśyati sa paśyati ||13-28||","13.28 He sees, who sees the Supreme Lord, existing eally in all beings, the unperishing within the perishing."
13,29,13.29,"समं पश्यन्हि सर्वत्र समवस्थितमीश्वरम् |
न हिनस्त्यात्मनात्मानं ततो याति परां गतिम् ||१३-२९||","samaṃ paśyanhi sarvatra samavasthitamīśvaram .
na hinastyātmanātmānaṃ tato yāti parāṃ gatim ||13-29||",13.29 Because he who sees the same Lord eally dwelling everywhere does not destroy the Self by the self; he goes to the highest goal.
13,30,13.30,"प्रकृत्यैव च कर्माणि क्रियमाणानि सर्वशः |
यः पश्यति तथात्मानमकर्तारं स पश्यति ||१३-३०||","prakṛtyaiva ca karmāṇi kriyamāṇāni sarvaśaḥ .
yaḥ paśyati tathātmānamakartāraṃ sa paśyati ||13-30||","13.30 He sees, who sees that all actions are performed by Nature alone and that the Self is actionless."
13,31,13.31,"यदा भूतपृथग्भावमेकस्थमनुपश्यति |
तत एव च विस्तारं ब्रह्म सम्पद्यते तदा ||१३-३१||","yadā bhūtapṛthagbhāvamekasthamanupaśyati .
tata eva ca vistāraṃ brahma sampadyate tadā ||13-31||","13.31 When a man sees the whole variety of beings as resting in the One, and spreading forth from That alone, he then becomes Brahman."
13,32,13.32,"अनादित्वान्निर्गुणत्वात्परमात्मायमव्ययः |
शरीरस्थोऽपि कौन्तेय न करोति न लिप्यते ||१३-३२||","anāditvānnirguṇatvātparamātmāyamavyayaḥ .
śarīrastho.api kaunteya na karoti na lipyate ||13-32||","13.32 Being without beginning and being devoid of (any) alities, the Supreme Self, imperishable, though dwelling in the body, O Arjuna, neither acts nor is tainted."
13,33,13.33,"यथा सर्वगतं सौक्ष्म्यादाकाशं नोपलिप्यते |
सर्वत्रावस्थितो देहे तथात्मा नोपलिप्यते ||१३-३३||","yathā sarvagataṃ saukṣmyādākāśaṃ nopalipyate .
sarvatrāvasthito dehe tathātmā nopalipyate ||13-33||","13.33 As the all-pervading ether is not tainted, because of its subtlety, so the Self seated everywhere in the body is not tainted."
13,34,13.34,"यथा प्रकाशयत्येकः कृत्स्नं लोकमिमं रविः |
क्षेत्रं क्षेत्री तथा कृत्स्नं प्रकाशयति भारत ||१३-३४||","yathā prakāśayatyekaḥ kṛtsnaṃ lokamimaṃ raviḥ .
kṣetraṃ kṣetrī tathā kṛtsnaṃ prakāśayati bhārata ||13-34||","13.34 Just as the one sun illumines the whole world, so also the Lord of the field (Supreme Self) 
illumines the whole field, O Arjuna."
13,35,13.35,"क्षेत्रक्षेत्रज्ञयोरेवमन्तरं ज्ञानचक्षुषा |
भूतप्रकृतिमोक्षं च ये विदुर्यान्ति ते परम् ||१३-३५||","kṣetrakṣetrajñayorevamantaraṃ jñānacakṣuṣā .
bhūtaprakṛtimokṣaṃ ca ye viduryānti te param ||13-35||","13.35 They who, by the eye of knowledge, perceive the distinction between the field and its knower and also the liberation from the Nature of being, go to the Supreme."
14,1,14.1,"श्रीभगवानुवाच |
परं भूयः प्रवक्ष्यामि ज्ञानानां ज्ञानमुत्तमम् |
यज्ज्ञात्वा मुनयः सर्वे परां सिद्धिमितो गताः ||१४-१||","śrībhagavānuvāca .
paraṃ bhūyaḥ pravakṣyāmi jñānānāṃ jñānamuttamam .
yajjñātvā munayaḥ sarve parāṃ siddhimito gatāḥ ||14-1||","14.1 The Blessed Lord said  I will again declare (to thee) that supreme knowledge, the best of all knowledge, having known which all the sages have gone to the supreme perfection after this life."
14,2,14.2,"इदं ज्ञानमुपाश्रित्य मम साधर्म्यमागताः |
सर्गेऽपि नोपजायन्ते प्रलये न व्यथन्ति च ||१४-२||","idaṃ jñānamupāśritya mama sādharmyamāgatāḥ .
sarge.api nopajāyante pralaye na vyathanti ca ||14-2||","14.2 They who, having taken refuge in this knowledge, have attained to unity with Me, are neither born at the time of creation nor are they disturbed at the time of dissolution."
14,3,14.3,"मम योनिर्महद् ब्रह्म तस्मिन्गर्भं दधाम्यहम् |
सम्भवः सर्वभूतानां ततो भवति भारत ||१४-३||","mama yonirmahad brahma tasmingarbhaṃ dadhāmyaham .
sambhavaḥ sarvabhūtānāṃ tato bhavati bhārata ||14-3||","14.3 My womb is the great Brahma; in that I place the germ; thence, O Arjuna, is the birth of all beings."
14,4,14.4,"सर्वयोनिषु कौन्तेय मूर्तयः सम्भवन्ति याः |
तासां ब्रह्म महद्योनिरहं बीजप्रदः पिता ||१४-४||","sarvayoniṣu kaunteya mūrtayaḥ sambhavanti yāḥ .
tāsāṃ brahma mahadyonirahaṃ bījapradaḥ pitā ||14-4||","14.4 Whatever forms are produced, O Arjuna, in any womb whatsoever, the great Brahma is their womb and I am the seed-giving father."
14,5,14.5,"सत्त्वं रजस्तम इति गुणाः प्रकृतिसम्भवाः |
निबध्नन्ति महाबाहो देहे देहिनमव्ययम् ||१४-५||","sattvaṃ rajastama iti guṇāḥ prakṛtisambhavāḥ .
nibadhnanti mahābāho dehe dehinamavyayam ||14-5||","14.5 Purity, passion and inertia  these alities, O Arjuna, born of Nature, bind fast in the body, the embodied, the indestructible."
14,6,14.6,"तत्र सत्त्वं निर्मलत्वात्प्रकाशकमनामयम् |
सुखसङ्गेन बध्नाति ज्ञानसङ्गेन चानघ ||१४-६||","tatra sattvaṃ nirmalatvātprakāśakamanāmayam .
sukhasaṅgena badhnāti jñānasaṅgena cānagha ||14-6||","14.6 Of these, Sattva, which from its stainlessness is luminous and healthy, binds by attachment to happiness and by attachment to knowledge, O sinless one."
14,7,14.7,"रजो रागात्मकं विद्धि तृष्णासङ्गसमुद्भवम् |
तन्निबध्नाति कौन्तेय कर्मसङ्गेन देहिनम् ||१४-७||","rajo rāgātmakaṃ viddhi tṛṣṇāsaṅgasamudbhavam .
tannibadhnāti kaunteya karmasaṅgena dehinam ||14-7||","14.7 Know thou Rajas to be of the nature of passion, the source of thirst (for sensual enjoyment) and attachment; it binds fast, O Arjuna, the embodied one by attachment to action."
14,8,14.8,"तमस्त्वज्ञानजं विद्धि मोहनं सर्वदेहिनाम् |
प्रमादालस्यनिद्राभिस्तन्निबध्नाति भारत ||१४-८||","tamastvajñānajaṃ viddhi mohanaṃ sarvadehinām .
pramādālasyanidrābhistannibadhnāti bhārata ||14-8||","14.8 But know thou Tamas to be born of ignorance, deluding all embodied beings; it binds fast, O Arjuna, by heedlessness, indolence and sleep."
14,9,14.9,"सत्त्वं सुखे सञ्जयति रजः कर्मणि भारत |
ज्ञानमावृत्य तु तमः प्रमादे सञ्जयत्युत ||१४-९||","sattvaṃ sukhe sañjayati rajaḥ karmaṇi bhārata .
jñānamāvṛtya tu tamaḥ pramāde sañjayatyuta ||14-9||","14.9 Sattva attaches to happiness, Rajas to action, O Arjuna, while Tamas verily shrouding knowledge attaches to heedlessness."
14,10,14.10,"रजस्तमश्चाभिभूय सत्त्वं भवति भारत |
रजः सत्त्वं तमश्चैव तमः सत्त्वं रजस्तथा ||१४-१०||","rajastamaścābhibhūya sattvaṃ bhavati bhārata .
rajaḥ sattvaṃ tamaścaiva tamaḥ sattvaṃ rajastathā ||14-10||","14.10 Now Sattva arises (prevails), O Arjuna, having overpowered Rajas and Tamas; nor Rajas, having overpowered Sattva and Tamas; and now Tamas, having overpowered Sattva and Rajas."
14,11,14.11,"सर्वद्वारेषु देहेऽस्मिन्प्रकाश उपजायते |
ज्ञानं यदा तदा विद्याद्विवृद्धं सत्त्वमित्युत ||१४-११||","sarvadvāreṣu dehe.asminprakāśa upajāyate .
jñānaṃ yadā tadā vidyādvivṛddhaṃ sattvamityuta ||14-11||","14.11 When through every gate (sense) in this body, the wisdom-light shines, then it may be known that Sattva is predominant."
14,12,14.12,"लोभः प्रवृत्तिरारम्भः कर्मणामशमः स्पृहा |
रजस्येतानि जायन्ते विवृद्धे भरतर्षभ ||१४-१२||","lobhaḥ pravṛttirārambhaḥ karmaṇāmaśamaḥ spṛhā .
rajasyetāni jāyante vivṛddhe bharatarṣabha ||14-12||","14.12 Greed, activity, the undertaking of actions, restlessness, longing  these arise when Rajas is predominant, O Arjuna."
14,13,14.13,"अप्रकाशोऽप्रवृत्तिश्च प्रमादो मोह एव च |
तमस्येतानि जायन्ते विवृद्धे कुरुनन्दन ||१४-१३||","aprakāśo.apravṛttiśca pramādo moha eva ca .
tamasyetāni jāyante vivṛddhe kurunandana ||14-13||","14.13 Darkness, inertness, heedlessness and delusion  these arise when Tamas is predominant, O Arjuna."
14,14,14.14,"यदा सत्त्वे प्रवृद्धे तु प्रलयं याति देहभृत् |
तदोत्तमविदां लोकानमलान्प्रतिपद्यते ||१४-१४||","yadā sattve pravṛddhe tu pralayaṃ yāti dehabhṛt .
tadottamavidāṃ lokānamalānpratipadyate ||14-14||","14.14 If the embodied one meets with death when Sattva is predominant, then he attains to the spotless worlds of the knowers of the Highest."
14,15,14.15,"रजसि प्रलयं गत्वा कर्मसङ्गिषु जायते |
तथा प्रलीनस्तमसि मूढयोनिषु जायते ||१४-१५||","rajasi pralayaṃ gatvā karmasaṅgiṣu jāyate .
tathā pralīnastamasi mūḍhayoniṣu jāyate ||14-15||","14.15 Meeting death in Rajas, he is born among those who are attached to action; and dying in Tamas, he is born in the womb of the senseless."
14,16,14.16,"कर्मणः सुकृतस्याहुः सात्त्विकं निर्मलं फलम् |
रजसस्तु फलं दुःखमज्ञानं तमसः फलम् ||१४-१६||","karmaṇaḥ sukṛtasyāhuḥ sāttvikaṃ nirmalaṃ phalam .
rajasastu phalaṃ duḥkhamajñānaṃ tamasaḥ phalam ||14-16||","14.16 The fruit of good action, they say, is Sattvic and pure, verily the fruit of Rajas is pain, and ignorance is the fruit of Tamas."
14,17,14.17,"सत्त्वात्सञ्जायते ज्ञानं रजसो लोभ एव च |
प्रमादमोहौ तमसो भवतोऽज्ञानमेव च ||१४-१७||","sattvātsañjāyate jñānaṃ rajaso lobha eva ca .
pramādamohau tamaso bhavato.ajñānameva ca ||14-17||","14.17 From Sattva arises knowledge, and greed from Rajas; heedlessness and delusion arise from Tamas, and also ignorance."
14,18,14.18,"ऊर्ध्वं गच्छन्ति सत्त्वस्था मध्ये तिष्ठन्ति राजसाः |
जघन्यगुणवृत्तिस्था अधो गच्छन्ति तामसाः ||१४-१८||","ūrdhvaṃ gacchanti sattvasthā madhye tiṣṭhanti rājasāḥ .
jaghanyaguṇavṛttisthā adho gacchanti tāmasāḥ ||14-18||","14.18 Those who are seated in Sattva go upwards; the Rajasic dwell in the middle; and the Tamasic, abiding in the function of the lowest Guna, go downwards."
14,19,14.19,"नान्यं गुणेभ्यः कर्तारं यदा द्रष्टानुपश्यति |
गुणेभ्यश्च परं वेत्ति मद्भावं सोऽधिगच्छति ||१४-१९||","nānyaṃ guṇebhyaḥ kartāraṃ yadā draṣṭānupaśyati .
guṇebhyaśca paraṃ vetti madbhāvaṃ so.adhigacchati ||14-19||","14.19 When the seer beholds no agent other than the Gunas and knows That which is higher than they, he attains to My Being."
14,20,14.20,"गुणानेतानतीत्य त्रीन्देही देहसमुद्भवान् |
जन्ममृत्युजरादुःखैर्विमुक्तोऽमृतमश्नुते ||१४-२०||","guṇānetānatītya trīndehī dehasamudbhavān .
janmamṛtyujarāduḥkhairvimukto.amṛtamaśnute ||14-20||","14.20 The embodied one having crossed beyond these three Gunas out of which the body is evolved, is freed from birth, death, decay and pain, and attains to immortality."
14,21,14.21,"अर्जुन उवाच |
कैर्लिङ्गैस्त्रीन्गुणानेतानतीतो भवति प्रभो |
किमाचारः कथं चैतांस्त्रीन्गुणानतिवर्तते ||१४-२१||","arjuna uvāca .
kairliṅgaistrīnguṇānetānatīto bhavati prabho .
kimācāraḥ kathaṃ caitāṃstrīnguṇānativartate ||14-21||","14.21 Arjuna said  What are the marks of him who has transcended the three alities, O Lord? What is his conduct and how does he go beyond these three alities?"
14,22,14.22,"श्रीभगवानुवाच |
प्रकाशं च प्रवृत्तिं च मोहमेव च पाण्डव |
न द्वेष्टि सम्प्रवृत्तानि न निवृत्तानि काङ्क्षति ||१४-२२||","śrībhagavānuvāca .
prakāśaṃ ca pravṛttiṃ ca mohameva ca pāṇḍava .
na dveṣṭi sampravṛttāni na nivṛttāni kāṅkṣati ||14-22||","14.22 The Blessed Lord said  When light, activity and delusion are present, he hates them not, nor does he long for them when they are absent."
14,23,14.23,"उदासीनवदासीनो गुणैर्यो न विचाल्यते |
गुणा वर्तन्त इत्येवं योऽवतिष्ठति नेङ्गते ||१४-२३||","udāsīnavadāsīno guṇairyo na vicālyate .
guṇā vartanta ityevaṃ yo.avatiṣṭhati neṅgate ||14-23||","14.23 He who, seated like one unconcerned, is not moved by the alities, and who, knowing that the alities are active, is self-centred and moves not."
14,24,14.24,"समदुःखसुखः स्वस्थः समलोष्टाश्मकाञ्चनः |
तुल्यप्रियाप्रियो धीरस्तुल्यनिन्दात्मसंस्तुतिः ||१४-२४||","samaduḥkhasukhaḥ svasthaḥ samaloṣṭāśmakāñcanaḥ .
tulyapriyāpriyo dhīrastulyanindātmasaṃstutiḥ ||14-24||","14.24 Who is the same in pleasure and pain, who dwells in the Self, to whom a clod of earth, stone and gold are alike, who is the same to the dear and the unfriendly, who is firm, and to whom censure and praise are as one."
14,25,14.25,"मानापमानयोस्तुल्यस्तुल्यो मित्रारिपक्षयोः |
सर्वारम्भपरित्यागी गुणातीतः स उच्यते ||१४-२५||","mānāpamānayostulyastulyo mitrāripakṣayoḥ .
sarvārambhaparityāgī guṇātītaḥ sa ucyate ||14-25||","14.25 Who is the same in honour and dishonour, the same to friend and foe, abandoning all undertakings  he is said to have transcended the alities."
14,26,14.26,"मां च योऽव्यभिचारेण भक्तियोगेन सेवते |
स गुणान्समतीत्यैतान्ब्रह्मभूयाय कल्पते ||१४-२६||","māṃ ca yo.avyabhicāreṇa bhaktiyogena sevate .
sa guṇānsamatītyaitānbrahmabhūyāya kalpate ||14-26||","14.26 And he who serves Me with unswerving devotion, he, crossing beyond the alities, is fit for becoming Brahman."
14,27,14.27,"ब्रह्मणो हि प्रतिष्ठाहममृतस्याव्ययस्य च |
शाश्वतस्य च धर्मस्य सुखस्यैकान्तिकस्य च ||१४-२७||","brahmaṇo hi pratiṣṭhāhamamṛtasyāvyayasya ca .
śāśvatasya ca dharmasya sukhasyaikāntikasya ca ||14-27||","14.27 For I am the abode of Brahman, the immortal and the immutable, of everlasting Dharma and of absolute bliss."
15,1,15.1,"श्रीभगवानुवाच |
ऊर्ध्वमूलमधःशाखमश्वत्थं प्राहुरव्ययम् |
छन्दांसि यस्य पर्णानि यस्तं वेद स वेदवित् ||१५-१||","śrībhagavānuvāca .
ūrdhvamūlamadhaḥśākhamaśvatthaṃ prāhuravyayam .
chandāṃsi yasya parṇāni yastaṃ veda sa vedavit ||15-1||","15.1 The Blessed Lord said  They (the wise) speak of the indestructible peepul tree having its root above and branches below, whose leaves are the metres or hymns: he who knows it is a knower of the Vedas."
15,2,15.2,"अधश्चोर्ध्वं प्रसृतास्तस्य शाखा
गुणप्रवृद्धा विषयप्रवालाः |
अधश्च मूलान्यनुसन्ततानि
कर्मानुबन्धीनि मनुष्यलोके ||१५-२||","adhaścordhvaṃ prasṛtāstasya śākhā guṇapravṛddhā viṣayapravālāḥ .
adhaśca mūlānyanusantatāni karmānubandhīni manuṣyaloke ||15-2||","15.2 Below and above spread its branches, nourished by the Gunas; sense-objects are its buds; and below, in the world of men, stretch forth the roots, originating action."
15,3,15.3,"न रूपमस्येह तथोपलभ्यते
नान्तो न चादिर्न च सम्प्रतिष्ठा |
अश्वत्थमेनं सुविरूढमूलं
असङ्गशस्त्रेण दृढेन छित्त्वा ||१५-३||","na rūpamasyeha tathopalabhyate nānto na cādirna ca sampratiṣṭhā .
aśvatthamenaṃ suvirūḍhamūlaṃ asaṅgaśastreṇa dṛḍhena chittvā ||15-3||","15.3 Its form is not perceived here as such, neither its end nor its origin, nor its foundation nor resting place: having cut asunder this firmly rooted peepul tree with the strong axe of non-attachment."
15,4,15.4,"ततः पदं तत्परिमार्गितव्यं
यस्मिन्गता न निवर्तन्ति भूयः |
तमेव चाद्यं पुरुषं प्रपद्ये |
यतः प्रवृत्तिः प्रसृता पुराणी ||१५-४||","tataḥ padaṃ tatparimārgitavyaṃ yasmingatā na nivartanti bhūyaḥ .
tameva cādyaṃ puruṣaṃ prapadye .
yataḥ pravṛttiḥ prasṛtā purāṇī ||15-4||","15.4 Then That goal should be sought for, whither having gone none returns again. I seek refuge in that Primeval Purusha Whence streamed forth the ancient activity or energy."
15,5,15.5,"निर्मानमोहा जितसङ्गदोषा
अध्यात्मनित्या विनिवृत्तकामाः |
द्वन्द्वैर्विमुक्ताः सुखदुःखसंज्ञैर्-
गच्छन्त्यमूढाः पदमव्ययं तत् ||१५-५||","nirmānamohā jitasaṅgadoṣā adhyātmanityā vinivṛttakāmāḥ .
dvandvairvimuktāḥ sukhaduḥkhasaṃjñaira- gacchantyamūḍhāḥ padamavyayaṃ tat ||15-5||","15.5 Free from pride and delusion, victorious over the evil of attachment, dwelling constantly in the Self, their desires having completely turned away, freed from the pairs of opposites known as pleasure and pain, the undeluded reach the eternal goal."
